Rating,Title,Date,Verified Purchase,Body,Helpful Votes
5.0,Great Product for Cats,"June 26, 2015",Yes,"I actually bought this product for my cat because of his sensitive skin. I have never seen a cat actually enjoy a bath but when I used the shampoo on my cat, he actually stood still and let me massage it into his fur. It smells great too not like a medicine. My experience has been limited as I just recently purchased the shampoo and have only had the opportunity to use it once since I have a cat, but I was very impressed with the first experience.",0
5.0,Five Stars,"April 19, 2016",Yes,My dog can't tip them over so the food and water dosent make a mess,1
5.0,Perfect!,"March 29, 2016",Yes,Perfect!  I like the rubber ring on the bottom to keep the bowls in place.  Great quality!,1
3.0,Three Stars,"December 23, 2017",Yes,ok,0
4.0,Four Stars,"July 17, 2016",Yes,very good quality and fairly solid,1
5.0,Great product,"July 19, 2016",Yes,"I have used this 2 or 3 times &amp; really like it. It gets my puppy nice &amp; clean l &amp; makes her  smell nice, too.",0
1.0,Not good.,"June 7, 2016",Yes,No lip on bowl. Water everywhere. Not good.,1
5.0,Smells great and works great,"May 3, 2016",Yes,"Even though Cannes doesn't look too enthusiastic in the picture but we really like the oatmeal aloe and shea butter dog shampoo by OmegaPet!  Just the other day, this pittie decided to roll in dirt (again) during our walk and I had just gotten the shampoo, no better time to try this shampoo out, right?  First off, I want to say that Cannes, or many Pitbull breed has skin problems.  She has very sensitive skin, when I first got her, she had flakes/dandruff all over her.  I had changed her lifestyle, diet, and shampoo in the past three years in order for her to have a transformation.  Most shampoos are too harsh for her skin, so we have been using Burt's Bee honey oatmeal.  When I came across the OmegaPet oatmeal aloe and shea butter shampoo, and I saw it uses all natural ingredients, I'm sold...Comparing this to Burt's Bees's, I have to say I am more satisfy with OmegaPet.  Little bit of OmegaPet shampoo goes a long way, we only need a small amount to get her bubbles up as compare to Burt's bees.  It cleans really well, her skin was so soft after wash, smells really good and the most important thing is, it did not cause any irritation to her skin.  A very gentle dog shampoo, two thumbs up~  A great product, would recommend...I hope Cannes won't roll in dirt anytime soon but if she does, no worries, I will wash her with this new shampoo by OmegaPet!..Sample given for review purposes.",0
5.0,Five Stars,"October 26, 2017",Yes,Smells amazing and works great!,0
5.0,Nice,"August 4, 2015",Yes,"Our dog has sensitive skin and seems to itch and ""breakdance"" a lot.  This shampoo helps when her skin allergies act up and soothes the itches for several days.",0
5.0,I am very happy with this purchase,"March 26, 2017",Yes,"I am very happy with this purchase. Excellent quality, good size, the paw design is very cute. And could not beat the price getting two bowls (1 for water, 1 for food) for less than other bowls sell for just one.",1
5.0,Me and my lab love it,"August 29, 2017",Yes,Works really well and gets out tons of loose fur out but is gentle on my lab.  We are both extremely satisfied,1
1.0,Easily Broken,"April 4, 2016",Yes,We enjoyed this bird feeder for 3 days. Then it fell from chest height and broke into 3 pieces when it hit the ground...One star for me. I didn't get a chance to ask the birds their thoughts.,1
5.0,I think our dog likes these new treats more than the old ones.,"July 29, 2015",Yes,"Just gave our dog one of the new treats (new process, same 100% chicken liver).  I think he likes these new treats more than the old ones.  Not sure if it's just because they are new or because they taste better, but either way he still loves these treats as much or more.  The new treats are the darker ones on bottom in the pic and the old ones the lighter ones on top.  I emailed Brave Beagle and they replied very quickly, stating: ""Yes, we are changing from rounding the corners to a dicing process.  The ingredient - USDA inspected liver - and manufacturing facility is the same.""  They also said, ""If you or your pets aren't happy let me know.  We will of course refund any purchase you have made if necessary.""  Seems like a great company.",2
5.0,Well built,"December 19, 2015",Yes,I really like the design on this. Plus it is extremely sturdy and well built. The removable seed drawer is so much better than cheaper feeders.,0
5.0,Five Stars,"January 21, 2018",Yes,Love this brush ... works like it says!!!!,0
4.0,Four Stars,"July 9, 2017",Yes,Not bad for the price.,1
5.0,Beagle loves them!,"October 1, 2015",Yes,My beagle loves them!  He is a over eater and needs to loss weight!  He gets as excited about a few of the liver treats as he does a big heavy jerky strip!,0
4.0,Four Stars,"March 27, 2018",Yes,Good quality for the price.,0
5.0,Great bowls,"April 29, 2016",Yes,I like these because my dog can't chew them apart and because she can't move and spill them.,1
5.0,Big Bowls!,"March 16, 2016",Yes,These are HUGE. Very well made and happy with purchase.,1
5.0,My dog LOVES this!,"August 7, 2015",Yes,"My dog not only smells great, but has stopped scratching. Her fur is glossy and silky to the touch. She is a very happy girl. Thank you for this amazing product!",0
2.0,Two Stars,"August 4, 2016",Yes,Bottom ring comes off,1
5.0,Five Stars,"October 24, 2017",Yes,Best yet,0
3.0,Three Stars,"August 26, 2017",Yes,it could be better,0
5.0,Dalmatian approved brush,"September 8, 2017",Yes,Love this brush.  Works extremely well on Dalmatian hairs. Other brushes have never worked well on Dalmatians.,0
5.0,I recommend this for sure,"August 17, 2016",Yes,Awesome bird feeder lots of birds at my window this year my dog  loves it as much as my children,0
5.0,The tablets are very easy to break in half and he loves them,"June 18, 2016",Yes,"I purchased this product to help one of my cats with dry, itchy skin. While he eats a premium raw diet with lots of vitamins and nutrients, we've recently moved to a very hot and dry location, and I've now noticed him itching quite often. I also noticed that he developed a patch of dry, rough skin on one of his feet, and he seemed to have dandruff. I didn't want to have to deal with messy and smelly liquids, so I picked this product to try..The tablets are very easy to break in half and he loves them. They have very little smell but he seems to think they are a delicious cat treat. No problem getting him to eat them, and I've had to hide the bottle so he doesn't try to get more out..So far his coat seems a little softer and he seems less itchy. I am pleasantly surprised to have seen any changes this quickly, since I've only been giving them to him for five days. Hopefully the positive changes will continue!",3
3.0,Three Stars,"February 13, 2018",Yes,A lot smaller not as deep as it seems,1
5.0,Healthy and happy,"November 17, 2015",Yes,"I bought it because one of our dogs has recently become diabetic and must not have food between meals unless very small and pure protein. She has learned to expect a good treat to go in the kennel, so this is what we are trying. She gobbled a little piece right up this morning. So did her finicky sister.",1
5.0,The BEST dog shampoo for wirehair,"November 25, 2015",Yes,"He still doesn't love bath time, but we love this shampoo! I have tried a few different ones and this is my favorite by far. My dog is a wire-haired mutt, so his hair isn't naturally very soft but this shampoo actually makes it softer. I also love the scent. I have a super sensitive nose and can't stand very chemical-y, strong smells. This shampoo smells very natural and the lingering scent is really faint and soft. I can't stop petting and sniffing my dog! Definitely only buying this from now on.",5
5.0,good buy!,"April 22, 2016",Yes,"They are the perfect size for my lab!  It does slide, but very little.  I recommend this product!",1
5.0,Big fan of double-handle leashes; these are top quality!,"November 27, 2017",Yes,"I volunteer in a dog shelter so I was liking for a well-made, double-handle dog leash. Why?..Well, when you walk a dog past other dogs, everyone is protective of their territory. This is a temporary shelter so the dogs are in crates right now and taking a dog out of a crate for a walk is like running the gauntlet. Yes, you can hold the collar our lower on the leash for better control but for my money, the double-handle leash is the way to go...These are truly well made. The handles are comfortable and well padded. The leash is very sturdy. I haven't used it at the shelter yet, but I can tell it is going to be perfect. I've used enough leashes to know what I like and what works best. I hope to order more of these.",1
5.0,I love Omega products,"October 27, 2015",Yes,I love Omega products.  They do the job without harsh chemicals.  They stand behind their products and they want to make sure your satisfied.,0
3.0,Fills with water after it rains,"January 3, 2016",Yes,"Overall it's a ok window feeder, main flaw is that it fills with water when it rains, plan to drill little holes in the tray to offset this. Just hope it won't crack",0
1.0,One Star,"February 11, 2018",Yes,Received the wrong kind of doggy bowl. How can my puppy eat out of this?,1
5.0,Five Stars,"March 23, 2017",Yes,Nice bowls. Lightweight stainless. Removeable rubber rings make them easy to clean.,1
5.0,Easy to wash out,"June 10, 2015",Yes,This smells delicious and works well. Thick so you don't need too much to make it last. Easy to wash out. I brush my dog right after and have noticed his puppy dandruff is gone completely now. Yay!,0
5.0,Works great!,"January 4, 2016",Yes,Leaves my dogs hair smooth after a bath and smells really good. Also helps with her dry skin.,1
5.0,works well,"September 5, 2017",Yes,"Works well - removes a lot of dog hair. Easy to clean, also.  Dog's not too pleased with it, however.",0
4.0,Nice Dog Shampoo,"June 9, 2016",Yes,"The scent is nice, my dog's skin seems to be less itchy.  It doesn't foam as much as I would like.",0
5.0,Five Stars,"March 12, 2017",Yes,Dog likes it too.,1
2.0,Though I love the design,"January 14, 2016",Yes,"Though I love the design, have constant problems with the suction cups.  Tried everything, clean window, tiny amount of moisture on cup but it keeps falling off the window",1
1.0,I would not recommend for a larger dog,"April 18, 2016",Yes,These are way smaller than I expected. I would not recommend for a larger dog.,1
5.0,Giving this to my dog who has skin issue and it is helping,"September 4, 2016",Yes,"I have one pure breed Shih Tzu who has atopic dermatitis for 2 years and one Bichon and Shih Tzu mix who doesn't have any health issues. I bought this for pure Shih tzu, but I am feeding both at the same time. They are under 20lbs so I need a table for two of them. They are always crazy about foods and not that picky about foods, but this does not have good flavor on it so I was little worried about it. However, unexpectedly they really like this and it's been 4 days and actually, I noticed that their fur is really getting soft. Tofu (pure shih tau) took Apoquil for almost year and now it doesn't seem helping him anymore so I stopped it finally and decided to give him this instead. Before I found this, he needed to take a bath every 3-4days (2days if it's severe), but.. I am not sure it will be for awhile but the term is actually little longer and his skin looks better than before! It's not dramatic difference, but as a dog owner who has dealt with dog skin problems for a long time, I can tell even small difference right away. I really hope this can help my dog and also I am waiting for other package which will be provided to him with this - Homeopathy medicine. I will update again soon.",0
4.0,They helped,"August 10, 2016",Yes,These helped our new rescue dog. His fur now has a great shine to it. He likes the taste.,0
4.0,Four Stars,"February 11, 2017",Yes,Great for training! My boxer puppy loves them. They are a bit delicate though and they fall apart.,0
4.0,Good Product,"April 17, 2017",Yes,It worked but not as well as i wished,0
5.0,Perfect length for walking the dog,"December 17, 2017",Yes,"Perfect length for walking the dog, but when they need to be brought closer to heel, the short handle provides positive control without slipping through your hand. Great for heel training as well!",0
5.0,Five Stars,"October 28, 2017",Yes,Great set for small to medium dogs,1
5.0,Works well,"January 29, 2018",Yes,The ejector for the fur is pretty much useless but it sure does a good job of deshedding.,0
5.0,Five Stars,"December 17, 2016",Yes,My dog's skin is very dry.This product does help her.,0
5.0,Five Stars,"May 16, 2018",Yes,Works amazing and so easy to get the hair off.,0
5.0,Great dog bowls,"April 23, 2016",Yes,They are wonderful and easy to keep clean and do not roll around!!!!,1
5.0,Five Stars,"May 8, 2016",Yes,These bowls are real nice,1
5.0,Smells good and works good too!,"February 24, 2015",Yes,"Smells soo good! My dogs were not very happy about their baths, but I was excited to take them a bath with this awesome shampoo! They didn't have that wet dog smell after their baths and their coats were really soft and fluffy afterwards. I will have to comeback and see how the product affects their fur over time, but I'm giving it 5 stars for now!",0
5.0,Dog loves them. They are dry and make him ...,"August 21, 2015",Yes,Dog loves them. They are dry and make him sick his tongue out a bunch (which is really cute). Make sure you give water with them,1
3.0,but Petzone bowls.. Way better.,"November 3, 2016",Yes,The rubber ring around the bowl comes off easily.....Not great quality,1
5.0,Great comb for pets,"January 15, 2018",Yes,Great comb for pets! It's a little heavy but my rabbit loves it. It also takes off a lot of his fur when he's molting.,0
5.0,Love it!,"March 20, 2015",Yes,Love this shampoo for my golden retriever.  I was looking for something for her sensitive skin  ( specifically when it comes to soaps) and this one is great.  It has a great smell and her coat is very shiny and smooth.,0
5.0,GREAT Product. My black lab now eats his food ...,"April 8, 2017",Yes,GREAT Product.  My black lab now eats his food and not the bowls.,1
5.0,Five Stars,"May 1, 2016",Yes,This is only shampoo that stopped my little dog from itching,1
5.0,"Get it - you'll see 'your' birds so close up, you won't believe it","January 28, 2016",Yes,"5 stars isn't enough for this little bird feeder.  My kitchen and breakfast room are on the 2nd story (ranch over daylight basement), so I can never see the bird feeders in the backyard from the house.  After enjoying a similar hummingbird feeder all summer, I decided that this would be fun for the winter.  It took about 2 days for the birds to find it, but MAN they are loving it.  I fill with black oil sunflower seeds and a little finch food, and I have such a variety of birds - from Cardinals and Tufted Titmice to Chickadees and Wrens.  They don't care if they lights are on.  They don't care if we watch them or take pictures (usually).  It is very easy to clean/fill and the suction cups haven't failed yet (applied per the included instructions).  My kids think 'their birds' are a hoot to watch.  We haven't had any accidents with birds hitting the windows, but have had some smaller birds hanging off the screens and perching nearby as they line up.  These birds are truly a delight - with the feeder at eye level you can watch them up close in a way you probably never have before.",0
3.0,I ordered two and second one seems fine.,"January 8, 2015",Yes,"One clip broke on assembly, plastic too brittle, glued it back on and so far it is holding. I ordered two and second one seems fine.",1
5.0,Five Stars,"August 1, 2017",Yes,it works great,0
5.0,She was very pleased with the bowls,"March 3, 2016",Yes,"I bought these for a private animal rescue center.  She was very pleased with the bowls.  The reason being, the animals can't chew them up, they won't rust, and the size.  I was very pleased with the delivery.  On time as usual.  Thank you!!",1
5.0,Excellent quality,"October 16, 2017",Yes,Great quality much better that I expected. The second handle is perfect for controlling my large dog who likes to chase cars.,0
3.0,The dog shampoo is alright. Doesn't seem to irritate ...,"April 17, 2016",Yes,"The dog shampoo is alright. Doesn't seem to irritate my dog's skin, I just wish it had a fresher smell.",0
5.0,Works Very Well!,"August 16, 2016",Yes,This has worked wonders for our 8 year old German Shepherd even though she has only been on the tabs for about a week.,0
5.0,Love the smell and works great!,"September 18, 2015",Yes,My GSD has very sensitive skin and itches all the time. This works great. She is soft and clean and it smells like cookies!!!!,0
5.0,Five Stars,"August 18, 2017",Yes,It surely works on my cat!,0
5.0,Five Stars,"June 28, 2018",Yes,Perfect dog bowls,0
3.0,Otherwise not a bad product for the,"July 18, 2016",Yes,Kind of flimsy...rubber ring came off first thing. Otherwise not a bad product for the price,1
5.0,The paw prints on these are adorable! Plus,"May 8, 2018",Yes,"The paw prints on these are adorable! Plus, the two in one package is great- saves an extra trip somewhere or an extra box from Amazon. And, naturally, the price is unbeatable!",0
5.0,Best brush you could buy!,"June 19, 2018",Yes,This product is GREAT! My dog loved it and fell asleep while I was brushing him. He also begged for more when I stopped brushing him. The smaller comb worked fabulously on my cat.,0
1.0,One Star,"November 6, 2017",Yes,"Much larger than expected. Not suitable for puppies. After return shipping fee, only received a $3 refund.",1
5.0,Awesome bird feeder for any window,"September 18, 2014",Yes,"This bird feeder is great.  It is super clear, very easy to set up.  It was smaller than I was expecting, but it is a very good size...The base, which holds the food and has the perch, easily detaches for cleaning and filling.  It simply sets into two holes on the back, which is attached to the window by two large suction cups...It took several days for the local birds to find it.  I have it set up on a stationary pane of the sliding glass doors that go out to my balcony (which is on the 3rd floor).  I initially spread seed on the railing leading up to the base which I placed on the railing by the wall next to the window where I had attached the feeder...Once the birds were eating out of the base, I moved the feeder itself on the window (which is easy to do with the suction cups) so that it was down by the railing on the side and put the base back on the feeder...This, however, allowed a brazen squirrel to get in it.  When I came up to the window, he reluctantly went back to the railing and was just staring at me, as if to say ""What are you going to do about it?""  I stepped out onto the balcony and he scampered up the side of the building to the roof and peered over at me like he was waiting for me to leave so he could get back to his meal.  I moved the feed back to the center of the full-length window at shoulder height and haven't seen the squirrel since.  He'd have to be a flying squirrel with good aim to make it back into the feeder or would need suction cups on his feet to scale the window...The birds did start using it in the center of the window and now fight over a place on the perch...My cat loves watching the birds through the window.  He gives me dirty looks when I move around and scare the birds away from the feeder.  He says I'm a terrible wingman and he can't take me anywhere...I'm very happy with the purchase.  I highly recommend this feeder.",23
5.0,Good quality,"March 12, 2016",Yes,Just what I was looking for.  The great thing I found it on line in the convenience of my own home.,1
5.0,Was using Virbac's HPA blend with excellent resorts then they stopped making it,"September 1, 2016",Yes,"Second time I have ordered this product. Was using Virbac's HPA blend with excellent resorts then they stopped making it. Switched to Thunderpaws and it was as good if not better than Virbac at less cost. Great product for skin, coat and itching.",1
5.0,"Great product, we love being able to see the ...","July 24, 2015",Yes,"Great product, we love being able to see the birds close up from the office window. Also excellent customer service from the vendor!",0
4.0,Smells EXACTLY like cookies. But my lil furry baby isn't itching ...,"August 21, 2015",Yes,I despise the smell a bit. Smells EXACTLY like cookies. But my lil furry baby isn't itching as bad. So next time I will just order a different scent.,0
5.0,My dog was scratching so bad he would bleed and pull out hair,"July 19, 2015",Yes,My dog was scratching so bad he would bleed and pull out hair. After months of vet trips and switching food with expensive and poor results after ONE bath he is better.,0
5.0,Five Stars,"April 11, 2018",Yes,Gets what needs to get done efficiently.,0
5.0,Works!,"June 29, 2016",Yes,Doesn't suds as well as I would like but the dog doesn't itch... I call that a win!,0
5.0,It stays on the window and the birds love it. My cats are entertained all day from ...,"January 23, 2016",Yes,It stays on the window and the birds love it. My cats are entertained all day from the back of the sofa !!,0
5.0,Great doggie bowls!,"January 24, 2017",Yes,Great product. Would recommend.,0
1.0,It seemed to be doing a good job but after a few months I noticed my ...,"January 5, 2018",Yes,It seemed to be doing a good job but after a few months I noticed my German Shepherd's undercoat was matting. I have gone back to my previous comb and brush.,0
5.0,... write reviews but I have to tell everyone how pleased I am with these treats,"June 24, 2015",Yes,"I don't normally write reviews but I have to tell everyone how pleased I am with these treats. My ""baby"" has a very sensitive stomach and as a result I need to be very careful that I don't feed him grains or fillers. He LOVES these treats!!!!",0
5.0,Suds your Pet...,"August 25, 2015",Yes,"Awesome scent.  Shampoo has luxurious texture, as well.  Company should consider going into business for people too! 🐾😉",0
5.0,i use this on my dog that has allergies.,"November 21, 2015",Yes,i use this on my dog that has allergies.  it works very well and he does not have rashes after his bath now,0
4.0,Four Stars,"March 3, 2016",Yes,just what was expected,1
4.0,but otherwise good.,"June 30, 2016",Yes,"Very thin, but otherwise good.",1
5.0,No more towels!!,"May 2, 2016",Yes,Great for our two gentle giants. We have a Great Dane and a St. Bernard and it helps not following around them with a towel to pick up the acess water.,2
5.0,Five Stars,"September 22, 2016",Yes,A good shampoo for the dogs and I like that it smells like honey oats.,0
5.0,Five Stars,"March 7, 2016",Yes,"Good size, sleek design and the rubber bottom stops the bowls from slipping.",1
5.0,great leash. the second handle is,"May 25, 2018",Yes,great leash.  the second handle is....handy. nice and strong.,0
5.0,Five Stars,"June 9, 2017",Yes,This is the best window feeder I have ever had!!! Thanks Yardiculture!,0
5.0,"Dog loves these, cat envies the dog","November 12, 2015",Yes,"My dog responds to all treats. She's not finicky. She's a dog, after all, and will eat anything from dead fish to a roll of paper towels if it has been soiled with the right substance. But THESE? Oh my word...Within 5 minutes of opening, both my 90-pound mutt AND my 10 pound mega-kitten were trying to get at the bag, and wrestling for the honor of doing so...The smaller bits fit nicely in her Kong toy so I can load it up with a combination of chicken treats and peanut butter. She will attempt to obey my commands even before I've given them if these treats are within smell range. It's a riot. Between these and the freeze dried beef bites also purchased at Amazon, I have no need for anything else. Good size bag for the money, as well.",1
5.0,Five Stars,"April 27, 2017",Yes,"Wonderful shampoo for my little Yorkies, it made their fur so soft.  Would definitely recommend this shampoo",0
3.0,more like 24 as it barely fits 3 cups of food,"December 1, 2016",Yes,way smaller than 32 oz.  more like 24 as it barely fits 3 cups of food.,1
5.0,Best Shampoo I have found,"September 10, 2016",Yes,BEST SHAMPOO!!.  My favorite for the pups!  I sure wish yall made it in a liter with a pump.,0
1.0,disposable dog bowls,"March 31, 2016",Yes,"I was hoping for a good thick quality bowl. Not! The bowls are thin, the bottom actually can be pushed like a lid that releases it's air seal.",2
5.0,Five Stars,"October 25, 2017",Yes,Very nice,1
5.0,I bought these for my Sister in Oregon they are ...,"November 3, 2015",Yes,"I bought these for my Sister in Oregon they are training their older dog ""Daisy"". She has food allergies and is a very picky eater. My Sister said she loves them.",0
5.0,Five Stars,"August 15, 2017",Yes,"Works very well, seems top shelf.",0
5.0,I was not expecting this to work as well as it did.,"September 18, 2015",Yes,smells good and worked so much better than expected. After I washed my dog his cost was so shinny and soft.,0
5.0,I am very satisfied!,"June 8, 2016",Yes,This shampoo is very soothing for my dogs sensitive skin! The smell is refreshing and subtle! I am very satisfied!,0
