Rating,Title,Date,Verified Purchase,Body,Helpful Votes
5.0,I love this feeder,"January 18, 2016",Yes,"I love this feeder.  It is on a window facing my kitchen window, and it is fun to see the birds close up.  The tray comes out easily for cleaning.  Sunflower seeds are the favorite amongst my visitors.",0
5.0,Perfect,"October 7, 2017",Yes,"Works great, my dog gets excited every time he sees it now.",0
5.0,treats go 5 start,"August 22, 2015",Yes,"Just opened the bag, but so far 5 stars from all of my dogs!",1
5.0,Excellent experience as always,"April 7, 2016",Yes,Product arrived quickly and was exactly as described. Excellent experience as always.,1
5.0,Five Stars,"April 1, 2017",Yes,Cute and Great Quality,0
5.0,... received this product faster than expected and our doggies love it - they think these are treats,"September 1, 2016",Yes,We received this product faster than expected and our doggies love it - they think these are treats!,0
5.0,Very nice lease. The padded hand loops are great,"March 13, 2018",Yes,Very nice lease.  The padded hand loops are great!,0
5.0,This feeder was easy to install,"November 7, 2014",Yes,"This feeder was easy to install, is solidly made, and should last for some time. Now I'm just waiting for the birds to discover it!",0
5.0,Good product.,"January 15, 2016",Yes,Works great even on my cat.,0
5.0,Super Bowls!,"February 24, 2016",Yes,Fast shipping. Quality material. Seems like they will last awhile.,1
3.0,Pretty good.,"June 17, 2015",Yes,"Shampoo works well, but bottle ink starts running when wet.",0
5.0,He watched with great fascination.,"January 5, 2017",Yes,Birds of all kinds flock to this thing! I'm going to get one for my grandson. He watched with great fascination...,0
5.0,Five Stars,"January 14, 2016",Yes,My dogs love these!,0
2.0,I used to love this shampoo for my dog but it is not ...,"September 2, 2017",Yes,I used to love this shampoo for my dog but it is not the same. The smell is way too strong!,0
5.0,"great product, great price.","April 14, 2016",Yes,I am happy with the bowls. My dogs can no longer spill the water and food all over the place!,1
5.0,Pretty cool feeder.,"February 15, 2016",Yes,"I don't normally write reviews, but I teased my wife that this wouldn't stay on for more than a day or two. I had to apologize because it's been a few or so and hasn't moved even though we've refilled it a dozen times and seen more than a couple bird kerfuffles on it. We had bought it for my three year old son to watch the birds right out the window, and it has been awesome. Woodpeckers, finches, things that look a bit like finches. Things that look a bit like woodpeckers. Tons of birds use it, and they don't seem to mind us watching them a few feet away on the other side of the window.",0
5.0,Great quality!,"January 13, 2015",Yes,"Great quality. So far so good as far as it sticking to the glass. It's been up a couple of weeks, and I'm not getting too many birds coming to it yet. I'm hoping that will change.",0
4.0,Seems to be a nice feeder - easy to put together and the instructions ...,"April 27, 2015",Yes,Seems to be a nice feeder - easy to put together and the instructions were a nice surprise!  Will see how it holds up over time and through the temp changes.. so far .. so good!,0
5.0,And he smells fantastic! Got the product very quickly too,"August 20, 2016",Yes,"Since moving from England to here, my dogs skin has been so dry.  This has helped with sorting that out.  And he smells fantastic!  Got the product very quickly too!",0
5.0,Five Stars,"December 3, 2016",Yes,very pleased with all aspects.,1
4.0,Four Stars,"January 22, 2016",Yes,"good suction, works great.",0
5.0,Great price with fast shipping!,"November 15, 2017",Yes,Great product! Great price!,0
5.0,Desheading Brush,"March 24, 2018",Yes,"I confess. I bought this both for my furbaby and myself. The Bichon doesn't shed,  but is inclined to get knots in her coat. This brush is great for keeping her fluffy, looking like she just got back from the groomers. Here's the strange part. I have long hair, and a tendency towards dandruff.  The dandruf combs out in flakes, and trying to comb it out was bring hair along with it. This brush glides through my hair, taking loose dry scalp with it, and with a push of the button, everything falls into the trash. My dog and I both highly recommend the brush!",0
5.0,Five Stars,"October 30, 2016",Yes,Wonderful shampoo for our dog! Smells great and leaves her coat silky soft.,0
5.0,Goes together in a flash and mounts easily.,"October 16, 2015",Yes,Exactly as advertised. Goes together in a flash and mounts easily.,0
5.0,Great product,"August 17, 2015",Yes,My dog has severe allergies and as a result is constantly scratching herself.  This shampoo provides some relief and smells great.,0
4.0,Only small birds use it,"March 13, 2016",Yes,"It's a decent feeder.  The suction cups are very strong and don't budge.  As far as it being squirrel proof- it's not.  They figured out how to climb the window frame, even though it's metal.  They can also launch themselves from a nearby branch or roof.  The cardinals around me barely use this feeder, and the blue jays don't use it at all.  It's mostly chickadees and finches.  Also, the green strip where the birds perch will not stay on.  My cats absolutely love this thing however, and I'll keep it just for that reason.",0
1.0,One Star,"May 23, 2018",Yes,Doesn’t work very well.,0
4.0,Four Stars,"June 8, 2016",Yes,Nice shampoo! Not super smelly and the smell is natural.,0
5.0,Recommended WITH a Caveat,"October 7, 2015",Yes,"This bird feeder is really lovely. We have three or four birds come to our window all the time. It's steady, durable, and easy to clean. We love seeing the birds...The only CON is that while I was researching how to attract birds to the feeder I read an article on the Audubon site that said that approximately 1 billion birds die in the United States from collisions with windows. This hasn't happened to us (we've had it up about 10 months), but I guess that depends on where you place it.",1
5.0,This tool is amazing! Not only does it take care of deshedding ...,"July 20, 2017",Yes,This tool is amazing! Not only does it take care of deshedding my boxer/pit he absolutely loves it and will sit while I brush him!!! Recommend!!!!,3
5.0,I would buy another one!,"January 25, 2016",Yes,"I purchased this window bird feeder because one of the Youtubers I watch made a gift idea video and this was one of the products she mentioned! I thought it would be cool to be able to watch birds from my bedroom window, so I bought it for myself..I ordered this product on December 26, 2015 and received it on December 30, 2015. However, I was only able to set it up the next week because of the constant rain. I do not remember the exact date I mounted the feeder. In the instructions that came with the product, it stated that it would take a few days for birds to discover the feeder. After a couple of weeks, I did not see any birds at all. However, I believe it was because it is attached to my bedroom window, which is on the second floor of the house. I thought about relocating it, but I decided to keep it there for a little longer..After coming back from a weekend trip, I saw that half of the food in the feeder was gone and that me really happy! So far, I have seen four different types of birds: Black-capped Chickadee, House Finch, Northern Cardinal, and even a Mourning Dove that could not find a way to get the food because he was too big, haha..Recently, winter storm Jonas came by and I was scared that my feeder would fall off. Being the person that I am, I was too lazy to remove it from the window. The winds were pretty strong despite not getting the most intense parts of the storm like in the north. After the storm subsided, my feeder was perfectly fine! It just got dirty from the snow. The suction cups that came with the feeder work very well. I always make sure to clean my window and spread a thin lining of water inside the suction cups before attaching it (like it says in the instructions)..I honestly want purchase another one because mine can occasionally get crowded.",0
5.0,Five Stars,"January 22, 2017",Yes,Good drainage and easy to clean,0
5.0,Happy dog,"November 17, 2016",Yes,"2nd time I have ordered this product and it is still something my dog loves very much. Simple, great product.",0
5.0,Five Stars,"April 5, 2018",Yes,GREAT QUALITY,0
5.0,Stainless Dog Bowls,"March 17, 2016",Yes,"Bowls are exactly as described. Good size, good look, and good grip on the bottom.",1
5.0,Five Stars,"January 15, 2016",Yes,"Works great - once the birds find it, they are stir all day",0
2.0,... the dogskin but mostly you would've thought he smelled better before the bath then after,"January 25, 2016",Yes,Didn't see too much of an improvement on the dogskin but mostly you would've thought he smelled better before the bath then after.,0
3.0,Too many crumbs ffor a treat.,"December 24, 2015",Yes,"There were a lot of ""tiny crumbs"" that I did not expect. It's hard to give a piece of the treat when it's crumbs.  Since the bag was not completely fill, the product may have been tossed around during shipment and therefore there were ""many crumbs.""  It would have been better if there had been a type of ""filler"" in the space to prevent toss around.  Maybe the treats were too brittle or sorts.  Had to give several crumbs to each of my pets, although they did like it.  But, not sure if I would purchase again.",0
5.0,Fun Window Feeder,"December 5, 2015",Yes,"Great fun to watch birds come to the window. The rubber stripe tends to come off if larger birds come so we glued ours on, seems to work.",0
2.0,Two Stars,"September 5, 2016",Yes,It didn't help my furbabies itching.,0
5.0,Perfect brush,"February 22, 2018",Yes,Perfect brush,0
5.0,Loved it. Great fragrance and left hair feeling clean,"May 10, 2016",Yes,Loved it.  Great fragrance and left hair feeling clean.,0
5.0,Great little bird feeder.,"June 3, 2017",Yes,Great product for the price. Our cat loves sitting at the window watching the birds.,0
5.0,We were using a product suggested by our Dermatology Vet but this one works better.,"July 24, 2015",Yes,This product works for our dog who has major allergies.  We were using a product suggested by our Dermatology Vet but this one works better.,0
5.0,All American and though no cheap it is a good sized bag,"November 20, 2015",Yes,My dogs are thrilled. All American and though no cheap it is a good sized bag. I will definitely order agaib,0
1.0,One Star,"March 21, 2018",Yes,Doesn’t work at all,0
5.0,You gotta get one!,"January 5, 2015",Yes,"Update 2 - 07/20/15..I just purchased 2 more to replace one I just broke last weekend. No fault of the product...A little disappointed that this new batch has some issued with the green rubber extrusions. The groove that allows them to fit not onto the acrylic is too narrow. I've noticed after a day they're already starting to come off. Weird because I never had the issue with the original one and it was out for close to a year. I took a picture of the extrusion from the older feeder and the new one. I'm guessing a new supplier made these out of spec...Other than that they seem great...Update:..I've had ours up since the Fall 2014. It's been through a pretty rough Chicago winter through sub-zero temps and hasn't fallen off once. If your unit falls off after a day, the glass might not have been cleaned properly...I need to buy another one since the birds clear this thing out in a day if there's a lot of snow on the ground......I'm outside of Chicago here and installed this a number of weeks ago. It took that long for the birds to find it, but the cardinals seem to really like it. As far as the quality of the unit, it's very good. Plastic is clear and seems very durable. The suction cups are holding up very well with the cold as well. We like it so much, we're going to order up more of these.",9
5.0,but now that they have my cat and I are delighted! I love the lift off section,"December 27, 2015",Yes,"It took a while for the birds to find the feeder, but now that they have my cat and I are delighted! I love the lift off section, makes it easy to refill and clean.",0
5.0,Five Stars,"November 14, 2017",Yes,Works amazing for my husky,0
5.0,Sturdy.  Good value for the price. Comes with an extra blade.,"August 3, 2017",Yes,"Sturdy. Wish I could buy replacement blades. It comes unassembled but the blade clicks in place with a nice, satisfying sound. Worked well on my dog. Good value for the price, but the proof is in how long it stays sharp without beginning to pull the hair out, which is what happened with my $40 name brand Furminator after a year .",1
5.0,Five Stars,"January 19, 2016",Yes,"I loved it, stayed on my father's window perfectly.  Only problem was the squirrel who loved it also!",0
5.0,Five Stars,"March 3, 2016",Yes,THEY WILL LAST A VERY LONG TIME TY,0
5.0,Great bowls!,"March 2, 2016",Yes,Great bowls!  They don't move around when my dogs eat from them.  They are also easy to clean.,1
5.0,Five Stars,"January 9, 2016",Yes,I really like the design and quality of this bird feeder. The suction cups are excellent.,0
5.0,Five Stars,"December 26, 2015",Yes,Great product and received quickly,0
4.0,Four Stars,"April 10, 2016",Yes,Would like them to be deeper.,1
5.0,Five Stars,"April 8, 2016",Yes,Really good items! Better and cheaper than retail store!,1
5.0,Five Stars,"March 18, 2016",Yes,These bowls worked amazingly well!,1
4.0,Great Shampoo,"December 22, 2015",Yes,The shampoo smells so good. I like it and will order it again. I hope this shampoo will help my dog stop scratching.,0
5.0,I put this on my mom's Nursing Home room window ...,"January 13, 2016",Yes,I put this on my mom's Nursing Home room window and she loves it!!  It even holds squirrels which is the main reason I bought this product.,0
5.0,Five Stars,"July 24, 2017",Yes,loved the smell!,0
5.0,Five Stars,"February 29, 2016",Yes,Perfect little gift for the dogs!,1
5.0,Five Stars,"April 20, 2016",Yes,"Nice bowls, got them fast and a very good price.",1
5.0,Five Stars,"November 3, 2016",Yes,Our dog loves this shampoo.,0
5.0,Five Stars,"January 12, 2016",Yes,took a while for the birds to find it but now the goldfinches and nuthatches are chowing down,0
5.0,More control in dog-walking!!,"December 21, 2017",Yes,"Our new dog (almost 4 yrs old) is very strong.  When walking, he has jerked forward a few times and once I couldn't hold him with his regular lease. So, I made a second knot &amp; handle in his regular lease to give me more control.  When I saw these 2-handled leases by QOL TOP, I was excited to get one and give it a try.  It works great.  I'd prefer a little shorter overall lease (like 4 or 5 feet vs. 6 feet) but it's fine.  It's also very well-made.",0
5.0,Five Stars,"March 9, 2016",Yes,Exactly what I needed for a great price.,1
3.0,Three Stars,"March 30, 2016",Yes,Not as deep as I would have liked. Very shallow bowls. But get the job done.,1
5.0,"Stayed put, yet easy to clean/refill...great gift idea as well","September 18, 2015",Yes,"VERY easy to adhere to the window with strong suction cups that have not slipped at all even during hard rains. We haven't had a lot of birds on it, but enough to entertain our pets and us. Easy to clean - just slide it up and off the suction cups and rinse/dry and refill. I was concerned with a bird flying into the window to get it but husband assured me that would not be the case; they don't fly into birdfeeders and that's what they're seeing. Of course! :) Cardinals have especially been drawn to ours with a general birdseed mix.",0
2.0,its ok but wouldn't purchase again...,"September 24, 2015",Yes,its ok but wouldn't purchase again...not what I thought it would be didn't sooth our dog that has allergies,0
5.0,This was one of my favorite purchases! Feeder is good quality and construction,"January 6, 2015",Yes,"This was one of my favorite purchases! Feeder is good quality and construction. It did take about 3 days for the birds to find the feeder, but once they did, they visit it all day long.",0
5.0,Five Stars,"February 23, 2016",Yes,Great bowls and I received them quickly,1
5.0,Highly recommend this bird feeder,"January 18, 2016",Yes,"Highly recommend this bird feeder, the squirrels can't get to it and it discourages larger birds. We've seen an explosion of birds since we installed it.",0
5.0,Five Stars,"January 22, 2016",Yes,Attracts too many birds,0
5.0,... my dog's coat is so soft and smell so good!,"July 23, 2016",Yes,Makes my dog's coat is so soft and smell so good!,0
5.0,Great treats,"July 23, 2015",Yes,The dogs love these! The cat does too. I love that they are pure chicken but not messy or smelly.,0
5.0,Not only a great bird feeder,"November 21, 2014",Yes,"Not only a great bird feeder, but a fantastic seller as well!!!  If only all transactions could go as smoothly as this one did!!",0
5.0,Five Stars,"May 1, 2016",Yes,Bowls are good quality and live the paw prints on the side,1
1.0,... feeder for my Mom and Dad and they really enjoyed watching the birds,"January 9, 2015",Yes,I had brought this same bird feeder for my Mom and Dad and they really enjoyed watching the birds. It fell off the window after about 6 months. But since they had enjoyed it so much I purchased them this one for a Christmas gift. I am sorry to say that it didn't even stay on the window a week before it also fell off and broke. I guess the suction cups are just not stronger enough to hold. We went right by the directions. It is so sad because it is lots of fun to watch the birds when they come so close up to feed.,4
5.0,Five Stars,"April 14, 2016",Yes,Excellent quality! Fast delivery!,1
5.0,Five Stars,"May 11, 2017",Yes,They seem to be working well. Thank you.,0
5.0,Best window bird feeder ever,"June 2, 2015",Yes,"5 Stars - Very polite and cordial communications from seller. Item delivered ahead of schedule in perfect condition. This is my 5th window bird feeder, each time I bought a different brand and they all had pros and cons...until the Yardiculture window bird feeder A+++ no cons. The birds have been regular/frequent guests. It stays in place no matter the weather. Best window bird feeder ever.  It's easy to refill and easy to clean.  I just bought a second one to replace one of the other brands I had.",0
4.0,Great dog bowl,"July 22, 2016",Yes,Great dog bowl. Not as large as our previous one so we end up filling it more often since we have a 50 lb dog and two thirsty cats. Seems like good quality though and I like that there are two of them. I do wish the finish was a bit duller or something since it is difficult to glance at the bowl and see how much water is left.,1
5.0,Window  Bird Feeder,"April 3, 2016",Yes,This is perfect for watching birds! The removable tray makes it easy to fill and clean.,0
5.0,Five Stars,"July 11, 2017",Yes,"great product, great customer service",0
3.0,Not for us,"October 28, 2016",Yes,"Hard to know how to rate this, I can't tell you if it works or not.  My pup wouldn't touch them no matter how I tried to disguise it and although my cat ate them she chucked them back up about an hour later, tried for a couple of days but she was as tired of being sick as I was of cleaning it up, so not for us I'm afraid.",1
5.0,The birds and my wife love to look at each other thru the window feeder,"December 23, 2015",Yes,The birds and my wife love to look at each other thru the window feeder.  Beautiful to see the small birds in action.,0
5.0,This one is terrific. His coat is soft and shiny but best ...,"August 27, 2015",Yes,My golden retriever has sensitive skin. I have tried many other shampoos. This one is terrific. His coat is soft and shiny but best of all his skin isn't irritated.,0
5.0,Five Stars,"March 18, 2016",Yes,Great bowls especially the price.,1
5.0,Five Stars,"February 23, 2016",Yes,"Great value for the price, easy to clean. Glad I made this choice.",1
5.0,Five Stars,"January 12, 2017",Yes,Roxi's favorite training treat!,0
5.0,Satisfied!,"July 24, 2015",Yes,Left my dog feeling very soft and smelling great!!,0
5.0,Five Stars,"December 10, 2015",Yes,Works great!,1
5.0,I am pleased with the product,"August 21, 2015",Yes,Has helped with my dogs itching.  I am pleased with the product.,0
5.0,Five Stars,"March 2, 2016",Yes,Perfect Bowl with rubber grip in the bottom.,1
5.0,Five Stars,"January 19, 2016",Yes,As advertised.... waiting on the birds!,0
4.0,Not used yet,"February 5, 2015",Yes,"I purchased this item for a family member that loves the outdoors.  She is unable to walk on her own, and their family had recently bought a new motor home.  I haven't given it to her yet, but I'm sure she will enjoy it and can even take it on trips with the motor home.  I'm pretty sure she will like it.  'Just hope the suction cups actually secure it as I've never had much success with them myself.  The company shipped my order quickly and it arrived without damage as far as I can tell.",0
4.0,Four Stars,"March 29, 2016",Yes,Good bowls but smaller than expected,1
4.0,Four Stars,"February 10, 2016",Yes,Smells awesome and seems to be helping my dog's dry skin.,0
4.0,Four Stars,"January 8, 2017",Yes,Love it!,0
5.0,Oatmel dog shmpoo,"March 10, 2016",Yes,Good product.Smells like baby shampoo and leaves skin soft.I will recommend.,0
5.0,Five Stars,"November 19, 2015",Yes,Perfect gift for my dad - came packaged well and just as pictured.,0
5.0,canine happiness,"May 24, 2015",Yes,"She loves it, and her humans do too.  Now she's not so itchy-scratchy, and her coat is soft and very ""pet-able"".",0
5.0,Functional window feeder,"December 10, 2015",Yes,"Easy to mount with strong suction cups. Just wash the window well first. I like the fact that I can remove the seed tray from the mount for filling or cleaning without removing the whole feeder from the glass.  A couple of small drain holes might be nice. While the overhang protects the seed from typical rainy weather, wind can blow rain into the tray.  Overall, I am happier with this feeder compared to one I bought from Droll Yankees.  I bought one for my daughter's new apartment for Christmas.",0
5.0,Five Stars,"November 2, 2016",Yes,Both of our pups love these!,0
5.0,Five Stars,"October 2, 2015",Yes,Smells amazing!!!!  Dogs are definitely scratching less even after a week.  Love it!,0
4.0,smells good. don't know how effective it is because i ...,"May 12, 2015",Yes,"smells good. don't know how effective it is because i only used it one time, but it was on a cat and it went well, so i'm going to say good things.",0
5.0,Shea butter a great plus,"April 9, 2016",Yes,Nice shampoo mild for dogs with sensitive skin the addition of Shea butter is a great plus.,0
5.0,Five Stars,"August 5, 2015",Yes,Very good. My dog has very sensitive skin and this shampoo worked very well for him.,0
4.0,Four Stars,"December 26, 2016",Yes,fun to watch the birds,0
5.0,Five Stars,"August 27, 2015",Yes,Very pleased with product; very pleasant smell.  Delivered quickly!,0
5.0,Five Stars,"June 5, 2016",Yes,Love seeing all the birds. It only took about 2 days for them to find it!,0
5.0,easy to attach to window,"April 7, 2015",Yes,well built........easy to attach to window.........easy to add bird seed......easy to clean.......good visability............I have two- one in each window,0
5.0,Five Stars,"May 3, 2016",Yes,Very nice not heavy,1
5.0,Overall v.good,"July 22, 2015",Yes,Satified,0
5.0,Five Stars,"October 14, 2015",Yes,Our dogs love it,0
4.0,Four Stars,"August 3, 2016",Yes,ok,0
5.0,I bought this shampoo for my grandpuppy in Texas; ...,"March 13, 2017",Yes,I bought this shampoo for my grandpuppy in Texas; she has allergies and itchy skin.  My son said it worked wonders on her; no itchy skin and dry patches are almost gone.  Thank you!,2
5.0,Nice clean fragrance,"September 7, 2016",Yes,Works well. Nice clean fragrance.,0
5.0,This is very nice quality. Itr hangs up beautifully and is going ...,"September 8, 2014",Yes,"This is very nice quality.  Itr hangs up beautifully and is going to be a great deal of fun once I get the chickadees and tufted titmice to figure out where it is.  I've only had it up a couple of days now, and the goldfinches have found it, but I have peanuts in it for the other two mentioned.  It arrived very quickly though, and is a great feeder.",0
5.0,For now I am very pleased with my results so far and I would highly ...,"October 17, 2015",Yes,"Although I have only had this product for a few weeks I can honestly say it has really improved my German Shepards itching and shedding. He looks forward to his two pills every morning (he thinks they are treats). I am hoping these pills will help to reduce his fatty deposits, time will tell. For now I am very pleased with my results so far and I would highly recommend!",0
4.0,"Good product, best used in conjunction with daily conditioning sprays","April 21, 2015",Yes,Solid product. It has definitely helped our dog although I'm not sure yet how long it lasts.,1
4.0,Four Stars,"June 1, 2015",Yes,Very light,0
4.0,Four Stars,"May 11, 2015",Yes,very nice gentle smell!,0
5.0,Five Stars,"February 27, 2016",Yes,I put it on a second story window and had an abundance of birds the first day!,0
4.0,but sturdy. The rubber non-slip ring around the bottom is ...,"February 16, 2016",Yes,"Bowls are lightweight, but sturdy.  The rubber non-slip ring around the bottom is great.  The bowls are perfect for food, but the way they're made doesn't hold much water.  I'm taking one star off because it doesn't hold the 32 ounces advertised.",2
5.0,birds love,"February 20, 2015",Yes,"very well built, sticks to the window, and even holds squirrles, birds love it",0
